
Hi,Hello,2024-10-03 08:30:56
hello,"I'm fine, thank you",2024-11-29 21:58:01
what is the capital of India,"Mindfulness is the practice of being fully present in the moment, observing thoughts and feelings without judgment.",2024-11-29 21:58:18
Mindfullness is not the capital of India,"Mindfulness techniques include meditation, deep breathing, body scanning, and mindful eating.",2024-11-29 21:58:40
is new delhi the capital of India?,"Mindfulness techniques include meditation, deep breathing, body scanning, and mindful eating.",2024-11-29 21:58:52
done ayipoyindhi inka I am disconnecting,Growing a vegetable garden allows you to enjoy fresh produce and connect with nature.,2024-11-29 22:00:26
